{"candidate_processes": 0, "error_classes": {"ACCESS_DENIED": 14, "BOOTSTRAP_LOG_DIRECTORY": 40, "DIRECTORY_CREATION_FAILURE": 2, "LOG_CONFIGURATION_FAILURE": 480}, "formal_query_calls": 0, "formal_window_write_denial_present": true, "global_exposure": 0, "old_after_closed": true, "old_attempts": {"a": 1, "b": 0}, "old_frozen_runner_log_path_conflict": true, "old_log_files": 1, "old_protected_path_error_lines": 43, "old_window_terminal": "INVALID", "private_holdout_opened": false, "private_text_paths_digests_exported": false, "public_synthetic_reproductions": [{"errno": 1, "error_class": "PermissionError", "old_log_write_denied": true, "policy": "loopback", "separate_runtime_write_allowed": true}, {"errno": 1, "error_class": "PermissionError", "old_log_write_denied": true, "policy": "inbound-only", "separate_runtime_write_allowed": true}], "results": 0, "status": "ROOT_CAUSE_REPRODUCED", "synthetic_removed": true}
